title,price,location_date,size
Andar Moradia V3 Duplex nas Caldas de São Jorge,199.500 €,Caldas De São Jorge E Pigeiros - 23 de julho de 2024,210 m²
Quinta Senhorial T4 | Oliveira de Azeméis,425.000 €,Vila de Cucujães - 19 de julho de 2024,140 m²
Mobil Home V2 | IRM Riviera Suite | Toda equipada,25.950 €,Esgueira - 23 de julho de 2024,34 m²
"Quintinha T3 Duplex em Válega, Ovar.",600.000 €,Válega - Hoje às 23:33,37.800 m²
Moradia T3 para venda,265.000 €,Mozelos - Hoje às 23:06,"159,05 m²"
Moradia rentabilidade ++ M ano - ausência do país Aceita PROPOSTA,789.000 €Negociável,Glória E Vera Cruz - Hoje às 21:55,850 m²
Andar Moradia T3 - LUXUOSO,315.000 €,"Oliveira De Azeméis, Santiago De Riba-Ul, Ul, Macinhata Da Seixa E Madail - Hoje às 20:05",163 m²
Moradia T5 Isolada em Loureiro,200.000 €,Loureiro - Hoje às 20:03,186 m²
Moradia V3 com Closet + Mezaninos,470.000 €,Silvalde - Hoje às 19:45,240 m²
"Casa T3 em Válega de 170,00 m2",330.000 €,Válega - Hoje às 19:36,170 m²
Moradia com vista maravilhosa no centro do Luso,107.000 €,Luso - Hoje às 19:32,260 m²
Moradia T3 com Jardim e Garagem,299.000 €,Nogueira da Regedoura - Hoje às 18:50,168 m²
Moradia isolada T3+1 com piscina em Argoncilhe.,695.000 €,Argoncilhe - Hoje às 18:19,"449,85 m²"
"Moradia com adega e terreno, Mamarrosa, Oliveira do Bairro",125.000 €,"Bustos, Troviscal E Mamarrosa - 28 de junho de 2024",175 m²
Moradia de Luxo em Santa Maria da Feira,465.000 €,"Santa Maria Da Feira, Travanca, Sanfins E Espargo - Para o topo a 23 de julho de 2024",358 m²
Moradia de 3 frentes T4 junto à praia de Esmoriz,575.000 €,Esmoriz - Hoje às 15:42,361 m²
"Fantástica Quinta T4, Remodelada em Vale de Cambra, com lindo Salão de",460.000 €,Macieira de Cambra - Hoje às 18:15,400 m²
Moradia em Ilhavo,230.000 €,Ílhavo (São Salvador) - Hoje às 18:00,108 m²
Excelente Moradia Térrea T3 - Santa Joana,390.000 €,Santa Joana - Hoje às 17:58,"155,35 m²"
Moradia Térrea em Espinho,290.000 €,Espinho - Hoje às 17:57,70 m²
Moradia T3+1 Térrea em Santa Joana,155.000 €,Santa Joana - Hoje às 17:56,119 m²
Moradia T4+1 em Esgueira,445.000 €,Esgueira - Hoje às 17:49,"214,38 m²"
Moradia em Oliveirinha para restaurar com terreno de 2.000m2,68.500 €,Oliveirinha - Hoje às 17:49,95 m²
"Moradia T3 habitável para renovar, com 880m2 de terreno, local calmo e",136.000 €,São Miguel Do Souto E Mosteirô - Hoje às 17:45,123 m²
"Quinta T8 c/ terreno em Milheirós de Poiares, Santa Maria da Feira",190.000 €,Milheirós de Poiares - Hoje às 17:20,473 m²
"Fantástica moradia Isolada T3 com piscina, jardim e anexos",350.000 €,Calvão - Hoje às 17:14,"136,55 m²"
PARTICULAR- Moradia T4 de Luxo em Escapães-  Santa Maria da Feira,395.000 €Negociável,Escapães - Para o topo a 23 de julho de 2024,282 m²
Moradia T3 Renovada em Lourosa,285.000 €,Lourosa - Hoje às 17:12,130 m²
Moradia T3+1 junto ao Pinhal D’ Aberta em Esmoriz,375.000 €,Esmoriz - Hoje às 17:12,260 m²
Magnífica moradia T3 térrea geminada de 3 frentes a 5 minutos do Ce...,365.000 €,"Santa Maria Da Feira, Travanca, Sanfins E Espargo - Hoje às 16:58",150 m²
Moradia isolada T4 em Macinhata da Seixa com linhas modernas,290.000 €,"Oliveira De Azeméis, Santiago De Riba-Ul, Ul, Macinhata Da Seixa E Madail - Hoje às 16:40",270 m²
"Quinta T4 em Travanca, Oliveira de Azeméis",295.000 €,"Pinheiro Da Bemposta, Travanca E Palmaz - Hoje às 16:38",264 m²
Moradia T4 próxima da praia,179.000 €,Gafanha da Boa Hora - Hoje às 16:37,90 m²
Moradia V2+1 Renovada em Macinhata da Seixa,240.000 €,"Oliveira De Azeméis, Santiago De Riba-Ul, Ul, Macinhata Da Seixa E Madail - Hoje às 16:37",100 m²
Moradias Geminadas T3 em São Roque,275.000 €,São Roque - Hoje às 16:35,130 m²
"Moradia Térrea V4 + 1 Independente com 4 Frentes, Jardim e Garagem,...",449.500 €,Lourosa - Hoje às 16:35,240 m²
Quinta em São João de Ver,440.000 €,São João de Ver - Hoje às 16:35,3.520 m²
"Moradia Isolada T4 em São Lourenço do Bairro, Anadia",345.000 €,S. Lourenço Do Bairro - Hoje às 16:32,"426,30 m²"
"Moradia Isolada T3 Venda em Silvalde,Espinho",235.000 €,Silvalde - Hoje às 16:25,73 m²
"Moradia geminada T4, perto do centro da vila.",170.000 €,Sever do Vouga - Hoje às 16:15,272 m²
Moradia para investimento no centro de Esgueira,225.000 €,Esgueira - Hoje às 16:15,267 m²
Moradia em Anta - Espinho,250.000 €,Anta E Guetim - Hoje às 16:15,50 m²
Moradia T3 para venda,145.000 €,Sangalhos - Hoje às 16:09,72 m²
"Fantástica Moradia Geminada T3, Vila De Cucujães (Oliveira De Azeméis)",307.500 €,Vila de Cucujães - Hoje às 16:04,163 m²
Casa rústica T2 - Em fase de restauro,200.000 €,Alvarenga - Hoje às 15:56,99 m²
Antiga serração - Frente de Rio,295.000 €,"Raiva, Pedorido E Paraíso - Hoje às 15:54",14.000 m²
Moradia de 3 frentes T4 junto à praia de Esmoriz,575.000 €,Esmoriz - Hoje às 15:42,361 m²
Andar Moradia V3 Duplex nas Caldas de São Jorge,199.500 €,Caldas De São Jorge E Pigeiros - 23 de julho de 2024,210 m²
PARTICULAR- Moradia T4 de Luxo em Escapães-  Santa Maria da Feira,395.000 €Negociável,Escapães - Para o topo a 23 de julho de 2024,282 m²
Moradia de Luxo em Santa Maria da Feira,465.000 €,"Santa Maria Da Feira, Travanca, Sanfins E Espargo - Para o topo a 23 de julho de 2024",358 m²
Moradia de 3 frentes T4 junto à praia de Esmoriz,575.000 €,Esmoriz - Hoje às 15:41,361 m²
"Moradia, Nogueira da Regedoura",490.000 €,Nogueira da Regedoura - Hoje às 15:20,199 m²
Moradia Geminada V3 Nova c/ Garagem em Milheiros de Poiares (Mamoa),320.000 €,Milheirós de Poiares - Hoje às 15:15,219 m²
Moradia com terreno para construção em solo Urbano Nivel 1 e 2 Albe...,535.000 €,Albergaria-A-Velha E Valmaior - Hoje às 15:12,"203,50 m²"
"Moradia independente no Bunheiro, Murtosa",180.000 €,Bunheiro - Hoje às 14:52,131 m²
Moradia T4 Isolada em Gafanha da Nazaré,320.000 €,Gafanha Da Nazaré - Hoje às 14:52,"450,30 m²"
Moradia T3 em Macinhata do Vouga,210.000 €,Macinhata do Vouga - Hoje às 14:46,384 m²
Moradia T2 para venda,222.500 €,Gafanha da Boa Hora - Hoje às 14:45,195 m²
Moradia T3 em fase de reabilitação situado em Santa Joana,155.000 €,Santa Joana - Hoje às 14:38,"70,50 m²"
Moradia Geminada T2 em Arrifana,178.000 €,Arrifana - Hoje às 14:35,43 m²
Mobil Home V2 | IRM Riviera Suite | Toda equipada,25.950 €,Esgueira - 23 de julho de 2024,34 m²
Quinta Senhorial T4 | Oliveira de Azeméis,425.000 €,Vila de Cucujães - 19 de julho de 2024,140 m²
Moradia de 3 frentes T4 junto à praia de Esmoriz,575.000 €,Esmoriz - Hoje às 15:42,361 m²
Moradia T4 térrea isolada - Aveiro,320.000 €,Cacia - Hoje às 14:35,"179,05 m²"
Moradia T3 no centro de Fermentelos,130.000 €,Fermentelos - Hoje às 14:31,114 m²
Moradia Oliveira de Azeméis,56.000 €,Ossela - Hoje às 14:31,45 m²
"Moradia em Cepelos, Vale de Cambra",27.500 €,Cepelos - Hoje às 14:31,88 m²
Moradia Santa Maria da Feira,390.000 €,"Santa Maria Da Feira, Travanca, Sanfins E Espargo - Hoje às 14:31",227 m²
Moradia em Vale de Cambra,27.500 €,Junqueira - Hoje às 14:31,86 m²
Moradia Santa Maria da Feira,390.000 €,"Santa Maria Da Feira, Travanca, Sanfins E Espargo - Hoje às 14:31",227 m²
Moradia Santa Maria da Feira,435.000 €,"Santa Maria Da Feira, Travanca, Sanfins E Espargo - Hoje às 14:31",240 m²
Casa para restauro em Arouca,35.000 €,Arouca E Burgo - Hoje às 14:31,30 m²
Moradias Geminadas T3+1,265.000 €,Cacia - Hoje às 14:30,140 m²
"Moradia com adega e terreno, Mamarrosa, Oliveira do Bairro",125.000 €,"Bustos, Troviscal E Mamarrosa - 28 de junho de 2024",175 m²
Moradia para restaurar,75.000 €,Recardães E Espinhel - Hoje às 14:08,400 m²
"Magnifica moradia geminada T3, Travanca - Santa Maria da Feira",320.000 €,"Ovar, São João, Arada E São Vicente De Pereira Jusã - Hoje às 14:01",245 m²
Ruína c/ terreno em Lobão (1346 m2),100.000 €,Argoncilhe - Hoje às 13:50,1.346 m²
Moradia T3 térrea em Oliveirinha,330.000 €,Oliveirinha - Hoje às 13:46,214 m²
Moradia T5 C/ Anexos E Logradouro C/1500 M2,485.000 €,Barcouço - Hoje às 13:44,500 m²
Moradia V-3 EM OVAR,490.000 €,Esmoriz - Hoje às 13:25,"229,70 m²"
Moradia 4 Frentes Em Ovar,685.000 €,Esmoriz - Hoje às 13:25,203 m²
Excelente Moradia T5 Toda Em Madeira,495.000 €,"Ovar, São João, Arada E São Vicente De Pereira Jusã - Hoje às 13:24",302 m²
Terreno Centro De Espinho Para 9 Frações,380.000 €,Espinho - Hoje às 13:24,168 m²
Moradia T6 Castelo De Paiva Com Piscina,380.000 €,Sobrado E Bairros - Hoje às 13:24,"227,30 m²"
Moradia Unifamiliar Aveiro,480.000 €,"Ovar, São João, Arada E São Vicente De Pereira Jusã - Hoje às 13:24",86 m²
Moradia Com Grande Terreno T2  Á Entrada De Espinho,285.000 €,Anta E Guetim - Hoje às 13:24,110 m²
Moradia T4 para venda,299.900 €,Esgueira - Hoje às 13:20,181 m²
Moradia T4+1 com terreno e piscina pronta a habitar,297.500 €,Moita - Hoje às 13:01,1.387 m²
Moradia T3 em Oliveira de Azemeis,420.000 €,"Oliveira De Azeméis, Santiago De Riba-Ul, Ul, Macinhata Da Seixa E Madail - Hoje às 12:59",381 m²
Quinta da Lavandeira - Paredes - Porto - Portugal,1.700.000 €,Aradas - Hoje às 12:54,5.720 m²
"Casa T5 em Anta E Guetim de 210,00 m2",319.000 €,Anta E Guetim - Hoje às 12:37,210 m²
"Moradia Individual T4, fáceis acessos A29, Esmoriz",420.000 €,Esmoriz - Hoje às 12:15,240 m²
"Moradia Geminada Térrea T3 em construção, Esmoriz",350.000 €,Esmoriz - Hoje às 12:15,135 m²
Moradia 3 quartos | anexos | jardim em Oliveirinha,550.000 €,Oliveirinha - Hoje às 12:00,152 m²
Andar Moradia V3 Duplex nas Caldas de São Jorge,199.500 €,Caldas De São Jorge E Pigeiros - 23 de julho de 2024,210 m²
"Moradia com adega e terreno, Mamarrosa, Oliveira do Bairro",125.000 €,"Bustos, Troviscal E Mamarrosa - 28 de junho de 2024",175 m²
Moradia de 3 frentes T4 junto à praia de Esmoriz,575.000 €,Esmoriz - Hoje às 15:42,361 m²
"Fantástica Moradia situada em Albergaria-a-Velha, no Lugar de Coche",265.000 €,"Pinheiro Da Bemposta, Travanca E Palmaz - Hoje às 11:44","166,16 m²"
Moradia T2 para venda,112.000 €,Macinhata do Vouga - Hoje às 11:25,50 m²
Moradia T2 para venda,220.000 €,Barcouço - Hoje às 11:23,71 m²
"Moradia T4 com 300 m2 de conforto e qualidade, em Albergaria-a-Velha",405.000 €,Albergaria-A-Velha E Valmaior - Hoje às 11:15,200 m²
"Quinta Kiwis, 1,7ha, 2 casas, piscina, Estrada Real, Águeda, Aveiro",690.000 €,Águeda E Borralha - Hoje às 11:11,17.096 m²
Moradia Bi-familiar - Junto à Praia de Esmoriz,285.000 €,Esmoriz - Hoje às 11:10,85 m²
Moradia Independente T3 em Ul,350.000 €,"Oliveira De Azeméis, Santiago De Riba-Ul, Ul, Macinhata Da Seixa E Madail - Hoje às 11:07",264 m²
Casa Rústica pronta a habitar - Arouca,450.000 €,Mansores - Hoje às 11:06,236 m²
Casa centenária - Castelo de Paiva,420.000 €,Santa Maria de Sardoura - Hoje às 11:04,5.824 m²
"Moradia T2 com terraço, lote c/1000m2 Luso (Mealhada) Portugal",175.000 €,Luso - Hoje às 11:02,72 m²
PARTICULAR- Moradia T4 de Luxo em Escapães-  Santa Maria da Feira,395.000 €Negociável,Escapães - Para o topo a 23 de julho de 2024,282 m²
Mobil Home V2 | IRM Riviera Suite | Toda equipada,25.950 €,Esgueira - 23 de julho de 2024,34 m²
Moradia de Luxo em Santa Maria da Feira,465.000 €,"Santa Maria Da Feira, Travanca, Sanfins E Espargo - Para o topo a 23 de julho de 2024",358 m²
Moradia V3 Semi-Nova em Lobão,475.000 €,Argoncilhe - Hoje às 11:01,349 m²
"Moradia T4 isolada com Anexo, lote com 1806m2, em Anadia",345.000 €,Arcos E Mogofores - Hoje às 11:01,273 m²
Moradia Geminada - Cacia,325.000 €,Cacia - Hoje às 11:00,"189,65 m²"
"Moradia 3 quartos em Canedo, Santa Maria da Feira",425.000 €,"Canedo, Vale E Vila Maior - Hoje às 10:59",376 m²
Casa Rústica pronta a habitar - Arouca,450.000 €,Mansores - Hoje às 10:59,1.384 m²
Moradia c/ 2 pisos independentes | Arquitetura tradicional totalmente,174.000 €,Canelas E Espiunca - Hoje às 10:41,197 m²
Moradia T3+1 em Eixo para venda!,240.000 €,Eixo E Eirol - Hoje às 10:39,73 m²
Moradia T3 - Villas Praia da Mâmoa,290.000 €,Milheirós de Poiares - Hoje às 10:36,202 m²
Moradia T3 - Villas Praia da Mâmoa,320.000 €,Milheirós de Poiares - Hoje às 10:36,209 m²
Moradia T3 - Villas Praia da Mâmoa,290.000 €,Milheirós de Poiares - Hoje às 10:36,202 m²
Quinta Senhorial T4 | Oliveira de Azeméis,425.000 €,Vila de Cucujães - 19 de julho de 2024,140 m²
Novo empreendimento de moradias na entrada do Parque da L...,375.000 €,"Oliveira De Azeméis, Santiago De Riba-Ul, Ul, Macinhata Da Seixa E Madail - Hoje às 10:36","164,78 m²"
Novo empreendimento de moradias na entrada do Parque da L...,395.000 €,"Oliveira De Azeméis, Santiago De Riba-Ul, Ul, Macinhata Da Seixa E Madail - Hoje às 10:36","368,26 m²"
Novo empreendimento de moradias na entrada do Parque da L...,410.000 €,"Oliveira De Azeméis, Santiago De Riba-Ul, Ul, Macinhata Da Seixa E Madail - Hoje às 10:36","198,39 m²"
Moradia T3 em Banda- Travanca,390.000 €,"Santa Maria Da Feira, Travanca, Sanfins E Espargo - Hoje às 10:35",227 m²
Moradia T3+1 - Empreendimento Casas do Troncal,435.000 €,"Santa Maria Da Feira, Travanca, Sanfins E Espargo - Hoje às 10:35",240 m²
"Moradia T4 + 1 em Esgueira, a 5 minutos do centro da cidade.",445.000 €,Esgueira - Hoje às 10:34,"252,20 m²"
Dois andares moradia - Vista panorâmica,59.000 €,Fiães - Hoje às 10:24,80 m²
Moradia T3 - Empreendimento Casas do Troncal,390.000 €,"Santa Maria Da Feira, Travanca, Sanfins E Espargo - Hoje às 10:18",227 m²
Moradia T3 - Empreendimento Casas do Troncal,390.000 €,"Santa Maria Da Feira, Travanca, Sanfins E Espargo - Hoje às 10:18",227 m²
Moradia T3 - Empreendimento Casas do Troncal,390.000 €,"Santa Maria Da Feira, Travanca, Sanfins E Espargo - Hoje às 10:18",227 m²
Moradia T3 - Empreendimento Casas do Troncal,390.000 €,"Santa Maria Da Feira, Travanca, Sanfins E Espargo - Hoje às 10:18",211 m²
Moradia T4 na Praia da Barra com vista privilegiada sobre a Ria.,1.200.000 €,Gafanha Da Nazaré - Hoje às 10:14,282 m²
"Moradia T2 Venda em Fornelos,Cinfães",165.000 €,Canelas E Espiunca - Hoje às 10:03,"132,86 m²"
Excelente  Oportunidade De Investimento,220.000 €,Mozelos - Hoje às 10:03,56 m²
"Moradia T3 Venda em Branca,Albergaria-a-Velha",265.000 €,Branca - Hoje às 10:00,830 m²
"Moradia T5 Independente em Milheirós de Poiares, Santa Maria da Feira",395.000 €,Milheirós de Poiares - Hoje às 09:40,355 m²
Moradia T4 para venda,225.000 €,Alquerubim - Hoje às 09:40,220 m²
Moradia Térrea T2 independente em Válega,220.000 €,Válega - Hoje às 09:37,60 m²
♦️VENDA! Moradia T3 Geminada Cucujães – Oliveira de Azeméis♦️,307.500 €,Vila de Cucujães - Hoje às 09:35,247 m²
Moradia para reconstrução no centro de Santa Maria da Feira (zona ARU),169.750 €,"Santa Maria Da Feira, Travanca, Sanfins E Espargo - Hoje às 09:30","167,57 m²"
Mobil Home V2 | IRM Riviera Suite | Toda equipada,25.950 €,Esgueira - 23 de julho de 2024,34 m²
Moradia de 3 frentes T4 junto à praia de Esmoriz,575.000 €,Esmoriz - Hoje às 15:42,361 m²
"Moradia com adega e terreno, Mamarrosa, Oliveira do Bairro",125.000 €,"Bustos, Troviscal E Mamarrosa - 28 de junho de 2024",175 m²
"Andar moradia de 3 frentes, em Mozelos",189.900 €,Mozelos - Hoje às 09:30,116 m²
Moradia Térrea para venda!,315.000 €,S. Lourenço Do Bairro - Hoje às 09:22,"179,40 m²"
Moradia T3 com piscina!,320.000 €,Avelãs de Cima - Hoje às 09:15,"205,70 m²"
Moradia T3 Geminada em Pindelo,77.500 €,Nogueira Do Cravo E Pindelo - Hoje às 09:13,90 m²
"Moradia T4+2 com piscina | Pindelo, Oliveira de Azeméis | 30 minutos d",850.000 €,Nogueira Do Cravo E Pindelo - Hoje às 09:02,875 m²
Moradia T2 - Gafanha da Boa Hora,222.500 €,Gafanha da Boa Hora - Hoje às 09:01,195 m²
Moradia T7 Isolada para Venda!,287.500 €,Moita - Hoje às 08:50,"370,50 m²"
"Moradia V3 nova, independente, cond. fechado",390.000 €,"Santa Maria Da Feira, Travanca, Sanfins E Espargo - Hoje às 08:50",227 m²
Moradia para Venda!,120.000 €,"Amoreira Da Gândara, Paredes Do Bairro E Ancas - Hoje às 08:50",108 m²
"Moradias Independentes,  Novas  T3 E T3+1, Em Condominio",390.000 €,"Santa Maria Da Feira, Travanca, Sanfins E Espargo - Hoje às 08:49",227 m²
PARTICULAR- Moradia T4 de Luxo em Escapães-  Santa Maria da Feira,395.000 €Negociável,Escapães - Para o topo a 23 de julho de 2024,282 m²
Andar Moradia V3 Duplex nas Caldas de São Jorge,199.500 €,Caldas De São Jorge E Pigeiros - 23 de julho de 2024,210 m²
Quinta Senhorial T4 | Oliveira de Azeméis,425.000 €,Vila de Cucujães - 19 de julho de 2024,140 m²
Moradia T3 NOVA em Oliveira de Azeméis,250.000 €,"Oliveira De Azeméis, Santiago De Riba-Ul, Ul, Macinhata Da Seixa E Madail - Hoje às 08:49",156 m²
Moradia independente T4  em São Lourenço do Bairro,345.000 €,S. Lourenço Do Bairro - Hoje às 08:49,273 m²
Moradia T4 de LUXO com  Jardim e Piscina,750.000 €,Anta E Guetim - Hoje às 08:48,213 m²
Moradia T3 em Branca Albergaria A Velha,265.000 €,"Pinheiro Da Bemposta, Travanca E Palmaz - Hoje às 08:48",166 m²
Moradia T3 NOVA em Oliveira de Azeméis,290.000 €,"Oliveira De Azeméis, Santiago De Riba-Ul, Ul, Macinhata Da Seixa E Madail - Hoje às 08:47",156 m²
"Moradia  V4, Moderna, 3 suites em remodelação",695.000 €,Mozelos - Hoje às 08:46,449 m²
Moradia T4 em Anta - Espinho,595.000 €,Anta E Guetim - Hoje às 08:46,320 m²
"Casa antiga senhorial,Cucujães,Oliveira Azemeis",225.000 €,Vila de Cucujães - Hoje às 08:21,329 m²
Moradia T3 com Garagem em Ílhavo,1.325.000 €,Ílhavo (São Salvador) - Hoje às 08:17,"251,18 m²"
Moradia T5 com Garagem em Águeda,399.900 €,Águeda E Borralha - Hoje às 08:17,180 m²
Moradia de Luxo em Santa Maria da Feira,465.000 €,"Santa Maria Da Feira, Travanca, Sanfins E Espargo - Para o topo a 23 de julho de 2024",358 m²
Moradia T4 com Garagem Fechada em Aveiro,680.000 €,São Bernardo - Hoje às 08:17,"280,30 m²"
Moradia T3 com Garagem em Ílhavo,1.370.000 €,Ílhavo (São Salvador) - Hoje às 08:16,"251,18 m²"
Moradia T4 com Garagem Fechada na Gafanha da Nazaré,320.000 €,Gafanha Da Nazaré - Hoje às 08:16,138 m²
Moradia T4 com Garagem Fechada na Gafanha da Nazaré,320.000 €,Gafanha Da Nazaré - Hoje às 08:16,138 m²
Moradia T4 com Garagem Fechada na Gafanha da Nazaré,320.000 €,Gafanha Da Nazaré - Hoje às 08:16,138 m²
Moradia T4 com Garagem Fechada na Gafanha da Nazaré,320.000 €,Gafanha Da Nazaré - Hoje às 08:16,138 m²
Moradia T4 com piscina na Gafanha de Aquém,350.000 €,Ílhavo (São Salvador) - Hoje às 08:16,212 m²
Moradia T4 com Garagem Fechada na Gafanha da Nazaré,320.000 €,Gafanha Da Nazaré - Hoje às 08:16,138 m²
Moradia Isolada T5 em Esgueira,445.000 €,Esgueira - Hoje às 08:15,"252,20 m²"
Moradia T4+1 com Garagem Dupla Fechada em Aveiro,790.000 €,Esgueira - Hoje às 08:14,"350,25 m²"
Moradia T4+1 com Garagem Dupla Fechada em Aveiro,720.000 €,Esgueira - Hoje às 08:14,"252,40 m²"
Moradia T4 em Aveiro,520.000 €,Glória E Vera Cruz - Hoje às 08:14,"130,70 m²"
Moradia T3 com Garagem em Ílhavo,430.000 €,Gafanha Do Carmo - Hoje às 08:14,165 m²
Moradia T4+1 com Garagem Dupla Fechada em Aveiro,820.000 €,Esgueira - Hoje às 08:14,"287,50 m²"
Moradia T4+1 com Garagem Dupla Fechada em Aveiro,690.000 €,Esgueira - Hoje às 08:14,"239,11 m²"
Moradia T2 no Bairro da Beira Mar,425.000 €,Glória E Vera Cruz - Hoje às 08:12,124 m²
"Moradia T5, para remodelar - centro de Esgueira - Aveiro",125.000 €,Esgueira - Hoje às 08:06,87 m²
Habitacao + 2 fraccoes comercio,275.000 €,Murtosa - Hoje às 07:31,490 m²
Moradia em Xisto para restauro,39.900 €,Real - Hoje às 06:46,226 m²
Quinta em Oliveira de Azeméis,5.500.000 €,"Oliveira De Azeméis, Santiago De Riba-Ul, Ul, Macinhata Da Seixa E Madail - Hoje às 06:46","59,10 m²"
Mobil Home V2 | IRM Riviera Suite | Toda equipada,25.950 €,Esgueira - 23 de julho de 2024,34 m²
Moradia de 3 frentes T4 junto à praia de Esmoriz,575.000 €,Esmoriz - Hoje às 15:42,361 m²
Andar Moradia V3 Duplex nas Caldas de São Jorge,199.500 €,Caldas De São Jorge E Pigeiros - 23 de julho de 2024,210 m²
Moradia T4 em Aveiro,380.000 €,São Jacinto - Hoje às 06:46,202 m²
Moradia T3 Geminada em Santa Maria da Feira,475.000 €,"Santa Maria Da Feira, Travanca, Sanfins E Espargo - Hoje às 06:31",270 m²
Andar Moradia a 400m da Praia de Espinho,285.000 €,Espinho - Hoje às 06:31,93 m²
Moradia isolada Paços de Brandão,445.000 €,Paços de Brandão - Hoje às 06:31,228 m²
Moradia Geminada T3 mais 1 nos Passionistas,495.000 €,"Santa Maria Da Feira, Travanca, Sanfins E Espargo - Hoje às 06:31",300 m²
Moradia Geminada em Maceda,310.000 €,Maceda - Hoje às 06:31,135 m²
Moradia Junqueira,27.500 €,Junqueira - Hoje às 06:31,43 m²
Moradia T3 Travanca,390.000 €,"Santa Maria Da Feira, Travanca, Sanfins E Espargo - Hoje às 06:31",227 m²
Moradia Geminada Santa Maria da Feira,365.000 €,"Santa Maria Da Feira, Travanca, Sanfins E Espargo - Hoje às 06:01",118 m²
Moradia térrea isolada em Santa Maria da Feira,465.000 €,"Santa Maria Da Feira, Travanca, Sanfins E Espargo - Hoje às 06:01",150 m²
PARTICULAR- Moradia T4 de Luxo em Escapães-  Santa Maria da Feira,395.000 €Negociável,Escapães - Para o topo a 23 de julho de 2024,282 m²
Moradia de Luxo em Santa Maria da Feira,465.000 €,"Santa Maria Da Feira, Travanca, Sanfins E Espargo - Para o topo a 23 de julho de 2024",358 m²
"Moradia com adega e terreno, Mamarrosa, Oliveira do Bairro",125.000 €,"Bustos, Troviscal E Mamarrosa - 28 de junho de 2024",175 m²
Quinta C/ 3 moradias,5.500.000 €,"Oliveira De Azeméis, Santiago De Riba-Ul, Ul, Macinhata Da Seixa E Madail - Hoje às 06:00",59.100 m²
Casa senhorial do século XIX,550.000 €,"Oliveira De Azeméis, Santiago De Riba-Ul, Ul, Macinhata Da Seixa E Madail - Hoje às 05:46",7.620 m²
Casa centenária - Castelo de Paiva,420.000 €,Santa Maria de Sardoura - Hoje às 05:46,284 m²
Casa para restaurar perto do rio Paiva e Passadiços,77.500 €,Canelas E Espiunca - Hoje às 05:45,246 m²
Casa Centenária em Avanca - Terreno plano,120.000 €,Avanca - Hoje às 05:45,168 m²
Casa antiga com vista panorâmica + Terreno de construção,300.000 €,Fiães - Hoje às 05:45,283 m²
Quintinha com vista panorâmica - Terreno de construção,300.000 €,Fiães - Hoje às 05:45,5.050 m²
Duas casas antigas para restaurar em Castelo de Paiva,45.000 €,"Raiva, Pedorido E Paraíso - Hoje às 05:45",105 m²
Quinta Da Relva - Turismo/ Eventos Ou Habitaçao - Santa Maria Lamas,3.145.000 €,Santa Maria de Lamas - Hoje às 05:30,4.600 m²
Moradia T3 | Para recuperar | Venda | Habitação,19.900 €,Arões - Hoje às 05:20,30 m²
Quinta Senhorial T4 | Oliveira de Azeméis,425.000 €,Vila de Cucujães - 19 de julho de 2024,140 m²
Quinta vinícola secular,1.950.000 €,Santa Maria de Sardoura - Hoje às 04:45,644 m²
"Moradia independente em Esmoriz, zona rural",450.000 €,Esmoriz - Hoje às 04:36,164 m²
"Fantástica moradia T3+1, isolada a 5 minutos de Espinho",419.000 €,Silvalde - Hoje às 04:35,289 m²
Andar  Moradia T3 com Piscina - Conforto e Elegância.,195.000 €,Fiães - Hoje às 04:35,130 m²
"Magnifica Casa Vitorian no Luso "" A Casa das Acácias""",320.000 €,Pampilhosa - Hoje às 04:35,260 m²
Moradia T4 de 4 frentes no centro do Paços de Brandão,425.000 €,Paços de Brandão - Hoje às 04:35,280 m²
"Moradia T3 isolada térrea  em São Miguel de Souto, Santa Maria da Feir",415.000 €,São Miguel Do Souto E Mosteirô - Hoje às 04:35,175 m²
"Moradia centro Espinho, Rua 14 a 400 m da Praia para recuperar e com p",450.000 €,Espinho - Hoje às 04:35,280 m²
Fantástica Moradia T6 na Avenida Principal de Espinho,470.000 €,Espinho - Hoje às 04:35,162 m²
Moradia T3 na Patela - Santa Joana - Aveiro c/ Piscina,650.000 €,Aradas - Hoje às 04:35,216 m²
"Moradia para restauro, a 2 minutos do centro da cidade",79.900 €,"Santa Maria Da Feira, Travanca, Sanfins E Espargo - Hoje às 04:35",187 m²
Moradia T2 isolada em Santa Maria da Feira,240.000 €,"Santa Maria Da Feira, Travanca, Sanfins E Espargo - Hoje às 04:35",103 m²
Linda Moradia 03 Suites em Condominio Praia de Furadouro - Ovar - Port,540.000 €,"Ovar, São João, Arada E São Vicente De Pereira Jusã - Hoje às 04:35",192 m²
Quinta com potencial turístico com terreno de 10980 m2 com piscina e e,429.000 €,Santa Eulália - Hoje às 04:34,164 m²
Moradia Nova com Jardim e Piscina Espinho,630.000 €,Nogueira da Regedoura - Hoje às 04:34,620 m²
Moradia Nova com Jardim e Piscina Espinho,590.000 €,Nogueira da Regedoura - Hoje às 04:34,530 m²
Moradia térrea localizada em Lobão,175.000 €,"Lobão, Gião, Louredo E Guisande - Hoje às 04:34",113 m²
Excelente Moradia em  Espinho,750.000 €,Anta E Guetim - Hoje às 04:34,326 m²
Charmosa moradia independente - Argoncilhe,260.000 €,Argoncilhe - Hoje às 04:34,400 m²
Venda moradia Bi-Familiar T2 + terreno com 168 m2 com armazem de 20 me,187.000 €,Caldas De São Jorge E Pigeiros - Hoje às 04:34,52 m²
Andar Moradia V3 Duplex nas Caldas de São Jorge,199.500 €,Caldas De São Jorge E Pigeiros - 23 de julho de 2024,210 m²
"Moradia com adega e terreno, Mamarrosa, Oliveira do Bairro",125.000 €,"Bustos, Troviscal E Mamarrosa - 28 de junho de 2024",175 m²
Moradia de 3 frentes T4 junto à praia de Esmoriz,575.000 €,Esmoriz - Hoje às 15:42,361 m²
"Excelente Moradia Em Geminada, com muito Espaço e Luz.",365.000 €,Romariz - Hoje às 04:34,179 m²
"Moradia Unifamiliar com 4 frentes, garagem fechada, churrasqueira e ja",330.000 €,Argoncilhe - Hoje às 04:33,180 m²
