title,price,location_date,size
PARTICULAR- Moradia T4 de Luxo em Escapães-  Santa Maria da Feira,395.000 €Negociável,Escapães - Para o topo a 23 de julho de 2024,282 m²
Moradia T4+2 de 2 pisos independentes a 8 minutos do Centro de Aveiro,330.000 €,Gafanha Da Nazaré - 23 de julho de 2024,236 m²
"Moradia V3, Santa Maria da Feira",420.000 €,"Santa Maria Da Feira, Travanca, Sanfins E Espargo - 23 de julho de 2024",322 m²
Moradia Isolada em Albergaria-a-Velha,425.000 €,Albergaria-A-Velha E Valmaior - 23 de julho de 2024,100 m²
Moradia T2 para venda,250.000 €,Esgueira - 23 de julho de 2024,139 m²
"Moradia T2- Santa Joana, Aveiro",120.000 €,Santa Joana - 23 de julho de 2024,119 m²
Quinta Senhorial T4 | Oliveira de Azeméis,425.000 €,Vila de Cucujães - 19 de julho de 2024,140 m²
Moradia de 3 frentes T4 junto à praia de Esmoriz,575.000 €,Esmoriz - Hoje às 15:42,361 m²
Mobil Home V2 | IRM Riviera Suite | Toda equipada,25.950 €,Esgueira - 23 de julho de 2024,34 m²
Venda Moradia,40.000 €,"Pinheiro Da Bemposta, Travanca E Palmaz - 23 de julho de 2024",52 m²
Moradia T4 a 200 m da Praia no Furadouro,225.000 €,"Ovar, São João, Arada E São Vicente De Pereira Jusã - 23 de julho de 2024",97 m²
Moradia de Luxo em Santa Maria da Feira,465.000 €,"Santa Maria Da Feira, Travanca, Sanfins E Espargo - Para o topo a 23 de julho de 2024",358 m²
Moradia Térrea em Anta- Espinho,195.000 €,"Santa Maria Da Feira, Travanca, Sanfins E Espargo - 23 de julho de 2024","86,80 m²"
Moradia T4 para venda,399.000 €,Gafanha da Boa Hora - 23 de julho de 2024,206 m²
Moradia em Nogueira da Regedoura,240.000 €,Nogueira da Regedoura - 23 de julho de 2024,118 m²
"Quintinha T3 para Restaurar em Fermelã, Estarreja",140.000 €,Canelas E Fermelã - 23 de julho de 2024,2.120 m²
"Moradia Isolada T3+1 Venda em Vila de Cucujães,Oliveira de Azeméis",390.000 €,Vila de Cucujães - 23 de julho de 2024,175 m²
"Moradia Geminada T3 Venda em São Roque,Oliveira de Azeméis",275.000 €,São Roque - 23 de julho de 2024,116 m²
"Moradia Isolada T3 Venda em Oliveira de Azeméis, Santiago de Riba-Ul,",269.000 €,"Oliveira De Azeméis, Santiago De Riba-Ul, Ul, Macinhata Da Seixa E Madail - 23 de julho de 2024",135 m²
"Moradia com adega e terreno, Mamarrosa, Oliveira do Bairro",125.000 €,"Bustos, Troviscal E Mamarrosa - 28 de junho de 2024",175 m²
Andar Moradia V3 Duplex nas Caldas de São Jorge,199.500 €,Caldas De São Jorge E Pigeiros - 23 de julho de 2024,210 m²
PARTICULAR- Moradia T4 de Luxo em Escapães-  Santa Maria da Feira,395.000 €Negociável,Escapães - Para o topo a 23 de julho de 2024,282 m²
Moradia geminada T4 | Póvoa do Paço,280.000 €,Cacia - 23 de julho de 2024,152 m²
Moradia Térrea Jardim e Quintal-Venda  Anta - Espinho,195.000 €,Anta E Guetim - 23 de julho de 2024,"86,80 m²"
Moradia T3 Remodelala na Gafanha da Nazaré,189.000 €,Gafanha Da Nazaré - 23 de julho de 2024,80 m²
Moradia T4 Isolada Pronta habitar,495.000 €,Esgueira - 23 de julho de 2024,227 m²
Moradia devoluta,275.000 €Negociável,Espinho - 23 de julho de 2024,144 m²
Moradia 4 Frentes - S. Paio de Oleiros,375.000 €,São Paio de Oleiros - 23 de julho de 2024,"319,70 m²"
Moradia T4 com piscina,350.000 €,Ílhavo (São Salvador) - 23 de julho de 2024,220 m²
Moradia T3 de luxo | centro de Aveiro,850.000 €,Glória E Vera Cruz - 23 de julho de 2024,168 m²
Moradia T4 nova | centro Gafanha da Nazaré,320.000 €,Gafanha Da Nazaré - 23 de julho de 2024,178 m²
Moradia T4 Isolada e linhas modernas | Centro do Troviscal,320.000 €,"Bustos, Troviscal E Mamarrosa - 23 de julho de 2024",326 m²
Moradia de Luxo em Santa Maria da Feira,465.000 €,"Santa Maria Da Feira, Travanca, Sanfins E Espargo - Para o topo a 23 de julho de 2024",358 m²
"Moradia Térrea T4+1, Nova - Rio Meão, Santa Maria da Feira",647.500 €,"Santa Maria Da Feira, Travanca, Sanfins E Espargo - 23 de julho de 2024",202 m²
"T4 de Luxo com Piscina a 3KM da Praia de Espinho, Aveiro",630.000 €,Anta E Guetim - 23 de julho de 2024,165 m²
"T4 de Luxo com Piscina a 3KM da Praia de Espinho, Aveiro",590.000 €,Anta E Guetim - 23 de julho de 2024,165 m²
Moradia T3 Isolada 4 frentes,445.000 €,"Santa Maria Da Feira, Travanca, Sanfins E Espargo - 23 de julho de 2024",150 m²
Moradia T4+1 de Luxo Renovada com Terraço e Vista Mar no Centro de Esp,750.000 €,Espinho - 23 de julho de 2024,249 m²
Moradia T4 de Luxo em Construção com Piscina e Vista Mar - Praia de Es,680.000 €,Esmoriz - 23 de julho de 2024,192 m²
"Duas Moradias para Reconstrução em Avelãs de Caminho, Anadia",42.500 €,Avelãs de Caminho - 23 de julho de 2024,276 m²
Moradia V2 no Centro de Lourosa,117.000 €,Lourosa - 23 de julho de 2024,65 m²
Moradia em Terreno com possibilidade de construção de pré...,425.000 €,Espinho - 23 de julho de 2024,157 m²
MORADIA T3 em MACEDA- 3 frentes com Anexos e espaço para Negócio In...,360.000 €,Maceda - 23 de julho de 2024,160 m²
Moradia T6 à venda em Águeda,375.000 €,Recardães E Espinhel - 23 de julho de 2024,320 m²
Moradia T3 com piscina em Cucujães,298.500 €,Vila de Cucujães - 23 de julho de 2024,222 m²
Fantástica moradia T4+Office; 4 Frentes a 1km de Espinho.,630.000 €,Anta E Guetim - 23 de julho de 2024,230 m²
Fantástica moradia T6 Praia de Esmoriz,698.000 €,Esmoriz - 23 de julho de 2024,298 m²
"Moradia na Costa Nova com piscina , Aveiro",675.000 €,Gafanha Da Encarnação - 23 de julho de 2024,119 m²
Moradia T5 à venda em Anadia,199.000 €,Arcos E Mogofores - 23 de julho de 2024,147 m²
Moradia em Murtosa,198.000 €,Bunheiro - 23 de julho de 2024,76 m²
Moradia Geminada - Cucujães,205.000 €,Vila de Cucujães - 23 de julho de 2024,164 m²
"Moradia T3 Venda em Cortegaça,Ovar",457.500 €,Cortegaça - 23 de julho de 2024,256 m²
Moradia para Restauro,45.000 €,Rôge - 23 de julho de 2024,77 m²
Andar Moradia V3 Duplex nas Caldas de São Jorge,199.500 €,Caldas De São Jorge E Pigeiros - 23 de julho de 2024,210 m²
PARTICULAR- Moradia T4 de Luxo em Escapães-  Santa Maria da Feira,395.000 €Negociável,Escapães - Para o topo a 23 de julho de 2024,282 m²
"Moradia com adega e terreno, Mamarrosa, Oliveira do Bairro",125.000 €,"Bustos, Troviscal E Mamarrosa - 28 de junho de 2024",175 m²
Moradia Térrea,1.250.000 €,Vila de Cucujães - 23 de julho de 2024,349 m²
Moradia T3 * Com Piscina * Terreno c/ 850 m2 * Vale de Cambra,649.000 €,São Pedro de Castelões - 23 de julho de 2024,257 m²
Moradias NOVAS,420.000 €,"Oliveira De Azeméis, Santiago De Riba-Ul, Ul, Macinhata Da Seixa E Madail - 23 de julho de 2024",208 m²
Moradia V5 NOVA,380.000 €,Loureiro - 23 de julho de 2024,236 m²
Moradia T3 em fase de pedreiro- Cucujães,80.000 €,Vila de Cucujães - 23 de julho de 2024,"120,50 m²"
Moradia T4 em São Roque,340.000 €,São Roque - 23 de julho de 2024,"174,73 m²"
Moradia T4 em São Roque,365.000 €,São Roque - 23 de julho de 2024,"174,73 m²"
Moradia nova em Arrifana,380.000 €,Arrifana - 23 de julho de 2024,200 m²
Moradia em banda T3- Travanca,390.000 €,"Santa Maria Da Feira, Travanca, Sanfins E Espargo - 23 de julho de 2024",227 m²
Moradia em banda T3- Travanca,390.000 €,"Santa Maria Da Feira, Travanca, Sanfins E Espargo - 23 de julho de 2024",227 m²
Quinta Senhorial T4 | Oliveira de Azeméis,425.000 €,Vila de Cucujães - 19 de julho de 2024,140 m²
Mobil Home V2 | IRM Riviera Suite | Toda equipada,25.950 €,Esgueira - 23 de julho de 2024,34 m²
Moradia de Luxo em Santa Maria da Feira,465.000 €,"Santa Maria Da Feira, Travanca, Sanfins E Espargo - Para o topo a 23 de julho de 2024",358 m²
Moradia T3 em São João da Madeira,350.000 €,S. João Da Madeira - 23 de julho de 2024,"188,10 m²"
Moradia T3 em banda- Travanca,390.000 €,"Santa Maria Da Feira, Travanca, Sanfins E Espargo - 23 de julho de 2024",211 m²
Moradia T3 Isolada Oliveira de Azemeis,420.000 €,"Oliveira De Azeméis, Santiago De Riba-Ul, Ul, Macinhata Da Seixa E Madail - 23 de julho de 2024",380 m²
Moradia T4 em Cucujães,330.000 €,Vila de Cucujães - 23 de julho de 2024,195 m²
Moradia no Pinheiro da Bemposta,250.000 €,"Pinheiro Da Bemposta, Travanca E Palmaz - 23 de julho de 2024","244,23 m²"
Moradia T3 em Valongo do Vouga,155.000 €,Valongo do Vouga - 22 de julho de 2024,124 m²
Moradia T4 em Nogueira da Regedoura AL,745.000 €,Nogueira da Regedoura - 22 de julho de 2024,313 m²
Vendo Moradia T5 em Aveiro - Great 5-bedroom House for sale in Aveiro,409.000 €,Aveiro - Para o topo a 22 de julho de 2024,319 m²
Moradia T4 | Espinho | Vista Mar | Piscina Aquecida | Terreno 986m2,595.000 €,Silvalde - 22 de julho de 2024,213 m²
Fantástica Moradia Isolada em Travass...,320.000 €,Travassô E Óis Da Ribeira - 22 de julho de 2024,"246,22 m²"
Moradia de 3 frentes T4 junto à praia de Esmoriz,575.000 €,Esmoriz - Hoje às 15:42,361 m²
Moradia isolada em Recardães de Baixo...,159.000 €,Recardães E Espinhel - 22 de julho de 2024,175 m²
Moradia V3/T3 Isolada no Beco - Águed...,79.500 €,Macinhata do Vouga - 22 de julho de 2024,96 m²
Moradia T3 com Vista Exclusiva da Ria de Aveiro,285.000 €,Esgueira - 22 de julho de 2024,180 m²
"Moradia para Restaurar T2 Venda em Gafanha da Nazaré,Ílhavo",100.000 €,Gafanha Da Nazaré - 22 de julho de 2024,218 m²
Excelente Moradia em Pedra para Recuperar em Rôge - Vale Cambra,55.000 €,Macieira de Cambra - 22 de julho de 2024,113 m²
Moradia Térrea T3  mais  1 em Construção,350.000 €,Esgueira - 22 de julho de 2024,121 m²
Moradia isolada T3+1 em Esmoriz.,450.000 €,Esmoriz - 22 de julho de 2024,"187,68 m²"
Moradia para Reabilitação com Jardim e terreno com garagem fechada em,162.000 €,Bunheiro - 22 de julho de 2024,81 m²
Moradia T2 no centro de Aveiro,260.000 €,Glória E Vera Cruz - 22 de julho de 2024,91 m²
Moradia T3 em Ovar com frente para a Ria de Aveiro com terreno de 864m,580.000 €,"Ovar, São João, Arada E São Vicente De Pereira Jusã - 22 de julho de 2024",350 m²
"Moradia T3 em Urbanização residencial, Escapães, Santa Maria da Feira",384.000 €,Escapães - 22 de julho de 2024,218 m²
Moradia T3 para venda !,185.000 €,Sever do Vouga - 22 de julho de 2024,"118,89 m²"
Moradia Nova para Venda!,189.000 €,Vila Nova de Monsarros - 22 de julho de 2024,"155,60 m²"
"Moradia Térrea de Autor com piscina, inserida em terreno de 9000m2 em",995.000 €,Argoncilhe - 22 de julho de 2024,300 m²
Moradia Independente T6 em Oliveira do Bairro | ERA Imobiliária,349.000 €,Oliveira do Bairro - 22 de julho de 2024,264 m²
Moradia T3 para venda,179.900 €,Esgueira - 22 de julho de 2024,"108,20 m²"
"Moradia T3 em Romariz, Santa Maria da Feira",104.000 €,Romariz - 22 de julho de 2024,"126,50 m²"
"Moradia T5 em Ferreiros, Oliveira de Azeméis",599.000 €,"Pinheiro Da Bemposta, Travanca E Palmaz - 22 de julho de 2024",170 m²
Moradia Térrea T3 para remodelar em Santa Joana,155.000 €,Santa Joana - 22 de julho de 2024,453 m²
"Duas Moradias para venda em Salreu, Estarreja!",155.000 €,Salreu - 22 de julho de 2024,"149,27 m²"
Mobil Home V2 | IRM Riviera Suite | Toda equipada,25.950 €,Esgueira - 23 de julho de 2024,34 m²
Andar Moradia V3 Duplex nas Caldas de São Jorge,199.500 €,Caldas De São Jorge E Pigeiros - 23 de julho de 2024,210 m²
"Moradia com adega e terreno, Mamarrosa, Oliveira do Bairro",125.000 €,"Bustos, Troviscal E Mamarrosa - 28 de junho de 2024",175 m²
"Moradia T3+1 com piscina, em Escapães, Santa Maria da Feira.",469.000 €,Escapães - 22 de julho de 2024,241 m²
Moradia T3 para venda,290.000 €,Esmoriz - 22 de julho de 2024,190 m²
Moradia para restaurar em Sever do Vouga 35.000€,35.000 €,Sever do Vouga - 22 de julho de 2024,200 m²
Guest House em Espinho!,750.000 €,Anta E Guetim - 22 de julho de 2024,152 m²
Magnifica Moradia T4+1 perto da praia.,750.000 €,Espinho - 22 de julho de 2024,306 m²
Moradia T4+1 em Esgueira,720.000 €,Esgueira - 22 de julho de 2024,"252,40 m²"
Moradia T4+1 em Esgueira,790.000 €,Esgueira - 22 de julho de 2024,"350,25 m²"
Moradia T4+1 em Esgueira,690.000 €,Esgueira - 22 de julho de 2024,"239,10 m²"
Moradia T4+1 em Esgueira,820.000 €,Esgueira - 22 de julho de 2024,215 m²
Moradia para reabilitar - Espinho - 3 minutos da Praia,194.500 €,Anta E Guetim - 22 de julho de 2024,50 m²
Moradia de Luxo em Santa Maria da Feira,465.000 €,"Santa Maria Da Feira, Travanca, Sanfins E Espargo - Para o topo a 23 de julho de 2024",358 m²
Moradia de 3 frentes T4 junto à praia de Esmoriz,575.000 €,Esmoriz - Hoje às 15:42,361 m²
Quinta Senhorial T4 | Oliveira de Azeméis,425.000 €,Vila de Cucujães - 19 de julho de 2024,140 m²
Moradia Geminada T3+1 Venda Aveiro > Santa Joana,395.000 €,Santa Joana - 22 de julho de 2024,"96,54 m²"
Moradia Geminada T3 Venda Ílhavo > Gafanha da Nazaré,429.000 €,Gafanha Da Nazaré - 22 de julho de 2024,"140,70 m²"
"Moradia T3+1, em fase de construção, situada na Gafanha da Nazaré",394.000 €,Gafanha Da Nazaré - 22 de julho de 2024,175 m²
"Moradia T3 Nova Na Rua Jornal O Regional, São João Da Madeira",360.000 €,S. João Da Madeira - 22 de julho de 2024,187 m²
Moradia Geminada T2 Venda Aveiro > Glória e Vera Cruz,345.000 €,Aradas - 22 de julho de 2024,131 m²
Moradia em Banda T4 - Ovar,260.000 €,"Ovar, São João, Arada E São Vicente De Pereira Jusã - 22 de julho de 2024","164,80 m²"
Moradia em banda - Avanca,325.000 €,Avanca - 22 de julho de 2024,225 m²
Moradia Isolada - Ovar,185.000 €,"Ovar, São João, Arada E São Vicente De Pereira Jusã - 22 de julho de 2024",77 m²
Moradia T4 em Águeda,232.000 €,Águeda E Borralha - 22 de julho de 2024,115 m²
Moradia T3 - Rio Côvo/Águeda,91.000 €,Águeda E Borralha - 22 de julho de 2024,61 m²
PARTICULAR- Moradia T4 de Luxo em Escapães-  Santa Maria da Feira,395.000 €Negociável,Escapães - Para o topo a 23 de julho de 2024,282 m²
Moradia T2 para remodelar | Santa Joana,145.000 €,Santa Joana - 22 de julho de 2024,394 m²
Moradia com terreno Oliveira de Azeméis Palmaz,294.000 €,"Pinheiro Da Bemposta, Travanca E Palmaz - 22 de julho de 2024",600 m²
Moradia T4 Albergaria-a-Velha,395.000 €,Albergaria-A-Velha E Valmaior - 22 de julho de 2024,320 m²
"Moradia Geminada,T 5,São João da Madeira",265.000 €,S. João Da Madeira - 22 de julho de 2024,246 m²
Moradia T3 em Pedra - Escariz,260.000 €,Fermedo - 22 de julho de 2024,181 m²
Moradia T3 geminada na Costa Nova - Aveiro!!!,675.000 €,Gafanha Da Encarnação - 22 de julho de 2024,144 m²
Moradia Isolada T3 - Vila de Cucujães,288.000 €,Vila de Cucujães - 22 de julho de 2024,160 m²
Moradia térrea a 4 minutos de Aveiro com terreno,198.000 €,Cacia - 22 de julho de 2024,104 m²
Moradia isolada com Terreno e Churrasqueira,399.000 €,Mozelos - 22 de julho de 2024,130 m²
Moradia Isolada C/ Piscina - Argoncilhe,695.000 €,Argoncilhe - 22 de julho de 2024,450 m²
Moradia T3 em Romariz,104.000 €,Romariz - 22 de julho de 2024,126 m²
Moradia T3 a 5mn das praias da Barra e Costa Nova e a 7mn de Aveiro na,340.000 €,Gafanha Da Encarnação - 22 de julho de 2024,188 m²
Moradia T4 a poucos metros da Praia da Vagueira!!!,390.000 €,Gafanha da Boa Hora - 22 de julho de 2024,208 m²
"Moradia T4 isolada á venda, localizado em Nariz!!!",250.000 €,"Requeixo, Nossa Senhora De Fátima E Nariz - 22 de julho de 2024",245 m²
"Moradia T4+2 Combinando História e Modernidade, no centro de Ílhavo!!",384.000 €,Ílhavo (São Salvador) - 22 de julho de 2024,135 m²
Moradia T4 em Aveiro,1.200.000 €,Eixo E Eirol - 22 de julho de 2024,539 m²
Moradia T3 térrea e independente em Maceda,315.000 €,Maceda - 22 de julho de 2024,"247,35 m²"
Moradia Térrea 4 frentes em lote de 600m2 em Arada-Ovar,360.000 €,"Ovar, São João, Arada E São Vicente De Pereira Jusã - 22 de julho de 2024",255 m²
Moradia T4 Isolada em Gafanha da Nazaré,320.000 €,Gafanha Da Nazaré - 22 de julho de 2024,"450,30 m²"
Moradia Geminada T3 - São João Da Madeira,398.000 €,S. João Da Madeira - 22 de julho de 2024,176 m²
"Moradia com adega e terreno, Mamarrosa, Oliveira do Bairro",125.000 €,"Bustos, Troviscal E Mamarrosa - 28 de junho de 2024",175 m²
Quinta Senhorial T4 | Oliveira de Azeméis,425.000 €,Vila de Cucujães - 19 de julho de 2024,140 m²
Moradia de Luxo em Santa Maria da Feira,465.000 €,"Santa Maria Da Feira, Travanca, Sanfins E Espargo - Para o topo a 23 de julho de 2024",358 m²
Moradia c/ Terreno na Zona Histórica de Santa Maria da Feira !,219.000 €,"Santa Maria Da Feira, Travanca, Sanfins E Espargo - 22 de julho de 2024",200 m²
Moradia Geminada V3+1 c/ Garagem em Sta. Maria da Feira,320.000 €,"Santa Maria Da Feira, Travanca, Sanfins E Espargo - 22 de julho de 2024",245 m²
Moradia T3 Alvorada - Santa Joana,155.000 €,Santa Joana - 22 de julho de 2024,119 m²
Moradia para restauro em Cortegaça - Ovar,90.000 €,Cortegaça - 22 de julho de 2024,186 m²
Moradia na zona serrana de Águeda,23.500 €,"Belazaima Do Chão, Castanheira Do Vouga E Agadão - 22 de julho de 2024",150 m²
Moradia em Banda V3+1 Nova em Sta. Maria da Feira (Travanca),450.000 €,"Santa Maria Da Feira, Travanca, Sanfins E Espargo - 22 de julho de 2024",290 m²
Excelente Moradia T4 em Anadia,480.000 €,Moita - 22 de julho de 2024,540 m²
Fabulosa Quinta T3+1 em Válega para turismo de hab,1.000.000 €,Válega - 22 de julho de 2024,200 m²
Moradia T3 de luxo em Santa Maria da Feira,415.000 €,"Lobão, Gião, Louredo E Guisande - 22 de julho de 2024","176,60 m²"
"Moradia T3 Venda em Espinho,Espinho",320.000 €,Espinho - 22 de julho de 2024,"102,60 m²"
Andar Moradia V3 Duplex nas Caldas de São Jorge,199.500 €,Caldas De São Jorge E Pigeiros - 23 de julho de 2024,210 m²
Moradia de 3 frentes T4 junto à praia de Esmoriz,575.000 €,Esmoriz - Hoje às 15:42,361 m²
Mobil Home V2 | IRM Riviera Suite | Toda equipada,25.950 €,Esgueira - 23 de julho de 2024,34 m²
Moradia T2 Caldas De São Jorge,145.000 €,Caldas De São Jorge E Pigeiros - 22 de julho de 2024,60 m²
Moradia T3 Vila De Cucujães,150.000 €,Vila de Cucujães - 22 de julho de 2024,98 m²
"Moradia T5 para venda em São Miguel de Souto, Santa Maria da Feira.",350.000 €,São Miguel Do Souto E Mosteirô - 22 de julho de 2024,225 m²
Moradia T5 Para Venda Em São Miguel De Souto,350.000 €,São Miguel Do Souto E Mosteirô - 22 de julho de 2024,232 m²
Moradia T5 Para Venda Em Pardilhó,298.900 €,Pardilhó - 22 de julho de 2024,204 m²
"Moradia T6 para venda em Mosteirô, Santa Maria da Feira",180.000 €,São Miguel Do Souto E Mosteirô - 22 de julho de 2024,126 m²
Moradia T4 Geminada à venda em Pinheiro da Bemposta,280.000 €,"Pinheiro Da Bemposta, Travanca E Palmaz - 22 de julho de 2024",188 m²
Moradia T3 Térrea Em Gafanha Da Encarnação,275.000 €,Gafanha Da Encarnação - 22 de julho de 2024,106 m²
Moradia T5 Para Venda Em Pardilhó,235.000 €,Pardilhó - 22 de julho de 2024,121 m²
"Encantadora Moradia T4, Localizada Em Oliveira Do Arda (Castelo De Pai",175.000 €,"Raiva, Pedorido E Paraíso - 22 de julho de 2024",167 m²
PARTICULAR- Moradia T4 de Luxo em Escapães-  Santa Maria da Feira,395.000 €Negociável,Escapães - Para o topo a 23 de julho de 2024,282 m²
"Moradia T3 Distrito de Aveiro, concelho de Águeda",249.000 €Negociável,Macinhata do Vouga - 22 de julho de 2024,190 m²
Moradia T2 + armazém a 1 km do parque de exposições de Aveiro,150.000 €,Santa Joana - 22 de julho de 2024,109 m²
"Moradia em Ruína, Pessegueiro do Vouga, Sever do Vouga",69.000 €,Pessegueiro do Vouga - 22 de julho de 2024,133 m²
MORADIA T3+1 Argoncilhe,695.000 €,Argoncilhe - 22 de julho de 2024,449 m²
Moradia T4 - Santa Joana,390.000 €,Esgueira - 22 de julho de 2024,230 m²
Casa dos Afectos - AL na Costa Nova,795.000 €,Gafanha Da Encarnação - 22 de julho de 2024,200 m²
"Casa T3 em Ovar, São João, Arada e São Vicente de Pereira Jusã de 204,",540.000 €,"Ovar, São João, Arada E São Vicente De Pereira Jusã - 22 de julho de 2024",204 m²
"Casa / Villa T3 em Santa Maria da Feira, Travanca, Sanfins e Espargo d",365.000 €,"Santa Maria Da Feira, Travanca, Sanfins E Espargo - 22 de julho de 2024",189 m²
"Casa T5 em Espinho de 302,00 m2",750.000 €,Espinho - 22 de julho de 2024,302 m²
"Andar Moradia T2 em Cucujães, Oliveira de Azeméis",115.000 €,Vila de Cucujães - 22 de julho de 2024,29 m²
Moradia T5 em Fermentelos,225.000 €,Fermentelos - 22 de julho de 2024,210 m²
Moradia T3 para venda,125.000 €,"Bustos, Troviscal E Mamarrosa - 22 de julho de 2024","165,50 m²"
Casa Rústica + Palheiro - Em fase de restauro,250.000 €,Fermedo - 22 de julho de 2024,"338,70 m²"
Moradia t4+1- Romariz,380.000 €Negociável,Romariz - 22 de julho de 2024,"106,14 m²"
Moradia T3 em Nogueira da Regedoura,265.000 €,Nogueira da Regedoura - 22 de julho de 2024,167 m²
Casa Rústica + Palheiro - Em fase de restauro,250.000 €,Fermedo - 22 de julho de 2024,4.058 m²
Moradia Térrea T3 – Oliveirinha,330.000 €,Oliveirinha - 22 de julho de 2024,214 m²
Moradia T2 + T3 em Sever do Vouga,90.000 €,Sever do Vouga - 22 de julho de 2024,172 m²
Moradia T3 em Argoncilhe,270.000 €,Argoncilhe - 22 de julho de 2024,210 m²
"Moradia isolada em restauro em Escariz, Arouca",165.000 €,Escariz - 22 de julho de 2024,181 m²
Andar Moradia V3 Duplex nas Caldas de São Jorge,199.500 €,Caldas De São Jorge E Pigeiros - 23 de julho de 2024,210 m²
"Moradia com adega e terreno, Mamarrosa, Oliveira do Bairro",125.000 €,"Bustos, Troviscal E Mamarrosa - 28 de junho de 2024",175 m²
Quinta Senhorial T4 | Oliveira de Azeméis,425.000 €,Vila de Cucujães - 19 de julho de 2024,140 m²
Moradia T4 + 1 - Lote nº 12,690.000 €,Glória E Vera Cruz - 22 de julho de 2024,202 m²
"Nova moradia térrea, a poucos minutos do centro de Aveiro",555.000 €,São Bernardo - 22 de julho de 2024,200 m²
Casa Contentor Modular T1,25.000 €Negociável,"Santa Maria Da Feira, Travanca, Sanfins E Espargo - 22 de julho de 2024",20 m²
Casa de campo para restaurar perto da Ria de Aveiro,95.000 €,Bunheiro - 22 de julho de 2024,"154,70 m²"
Moradia Isolada V3 em Mansores,295.000 €,Mansores - 22 de julho de 2024,436 m²
|Moradia | T3 | Isolada |Sever do Vouga |,265.000 €,Sever do Vouga - 22 de julho de 2024,213 m²
Moradia T3 Térrea Isolada em Escapães,384.000 €,Escapães - 22 de julho de 2024,409 m²
Moradia Isolada para restauro nas Caldas de São Jorge,128.000 €,Caldas De São Jorge E Pigeiros - 22 de julho de 2024,208 m²
Moradia T3 - Gafanha do Carmo,250.000 €,Gafanha Do Carmo - 22 de julho de 2024,128 m²
Moradia T4+1 - Ílhavo,325.000 €,Ílhavo (São Salvador) - 22 de julho de 2024,210 m²
Moradia de 3 frentes T4 junto à praia de Esmoriz,575.000 €,Esmoriz - Hoje às 15:42,361 m²
Moradia de Luxo em Santa Maria da Feira,465.000 €,"Santa Maria Da Feira, Travanca, Sanfins E Espargo - Para o topo a 23 de julho de 2024",358 m²
Mobil Home V2 | IRM Riviera Suite | Toda equipada,25.950 €,Esgueira - 23 de julho de 2024,34 m²
"Moradia para recuperar em Mosteirô, S...",67.000 €,São Miguel Do Souto E Mosteirô - 22 de julho de 2024,"45,05 m²"
Moradia T2 em Válega - Ovar,62.000 €,Válega - 22 de julho de 2024,336 m²
Moradia T3 Isolada em Vagos,220.000 €,Ponte De Vagos E Santa Catarina - 22 de julho de 2024,175 m²
"Moradia T3+1 em Loureiro, Oliveira de Azemeis",275.000 €,Loureiro - 22 de julho de 2024,145 m²
"Moradia T4 para remodelar em Ancas, Anadia",66.220 €,"Amoreira Da Gândara, Paredes Do Bairro E Ancas - 22 de julho de 2024","109,65 m²"
"Casa / Villa T5 em Sangalhos de 1004,00 m2",400.000 €,Sangalhos - 22 de julho de 2024,1.004 m²
Moradia térrea T2 para restauro na Gafanha da Nazaré,100.000 €,Gafanha Da Nazaré - 22 de julho de 2024,42 m²
Moradia Isolada em Albergaria-a-Velha!,257.000 €,Albergaria-A-Velha E Valmaior - 22 de julho de 2024,"134,60 m²"
Moradia T3 em Passegueiro do Vouga!,55.000 €,Pessegueiro do Vouga - 22 de julho de 2024,"85,54 m²"
Moradia para venda em São Roque - Oliveira de Azeméis,310.000 €,São Roque - 22 de julho de 2024,"266,56 m²"
PARTICULAR- Moradia T4 de Luxo em Escapães-  Santa Maria da Feira,395.000 €Negociável,Escapães - Para o topo a 23 de julho de 2024,282 m²
"Moradia para recuperar em Pedaçães, Lamas do Vouga",45.700 €,"Trofa, Segadães E Lamas Do Vouga - 22 de julho de 2024","132,60 m²"
Moradia para recuperar ou demolir em Aquerubim,90.000 €,Alquerubim - 22 de julho de 2024,300 m²
"Moradia para Reconstrução em Beduído, Estarreja",45.000 €,Beduído E Veiros - 22 de julho de 2024,84 m²
Venda Moradia,457.500 €,Cortegaça - 22 de julho de 2024,256 m²
Moradia T4 para venda,249.900 €,Avanca - 22 de julho de 2024,"93,90 m²"
Moradia T4 para venda,199.900 €,Monte - 22 de julho de 2024,139 m²
Moradia T3 para venda,359.900 €,Vila de Cucujães - 22 de julho de 2024,"156,80 m²"
Moradia T6 para venda,349.900 €,Torreira - 22 de julho de 2024,287 m²
Moradia T3 em condomínio fechado - Se...,235.000 €,Pessegueiro do Vouga - 22 de julho de 2024,"223,33 m²"
Moradia Isolada T4 em Estarreja,320.000 €,Beduído E Veiros - 22 de julho de 2024,"138,50 m²"
Moradia para restaurar no centro das Talhadas - Sever do ...,50.000 €,Sever do Vouga - 22 de julho de 2024,"68,02 m²"
Moradia T4 e 2 lotes de terreno no centro de Albergaria-a...,479.000 €,Albergaria-A-Velha E Valmaior - 22 de julho de 2024,"161,50 m²"
Moradia T4 em Canelas - Estarreja,395.000 €,Canelas E Fermelã - 22 de julho de 2024,"307,60 m²"
Moradia T3 - Ílhavo,220.000 €,Ílhavo (São Salvador) - 22 de julho de 2024,104 m²
"Casa / Villa T3 em Ovar, São João, Arada e São Vicente de Pereira Jusã",278.000 €,"Ovar, São João, Arada E São Vicente De Pereira Jusã - 22 de julho de 2024",144 m²
"Casa / Villa T5 em Válega de 225,00 m2",400.000 €,Válega - 22 de julho de 2024,225 m²
